<?xml version="1.0" encoding="gb2312"?>
<!DOCTYPE domain SYSTEM "Metadata_Auth_Main.dtd">
<domain id="admin" subsystem="exclude_portal_admin">
	<resource-category key="exclude_portal_admin" name="portal例外资源" desc="portal例外资源">
		<!-- session例外资源-->
		<resource key="exclude_portal_admin_session" name="session例外资源" desc="session例外资源" authType="UNAUTH">
			<operation key="EXCLUDE" name="例外" desc="例外">	
				<address name="登录action" url="/login"/>
				<address name="退出登录" url="/logout"/>
				<address name="404错误页面" url="/404.html"/>
				<address name="500错误页面" url="/pages/500.shtml"/>
				<address name="未授权提醒页面" url="/403"/>
				<address name="页面签权url" url="/auth/pageAuth"/>
			</operation>
		</resource>
			
		<!-- 鉴权例外资源-->
		<resource key="exclude_portal_admin_perm" name="鉴权例外资源" desc="鉴权例外资源" authType="LOGIN_AUTH">
			<operation key="EXCLUDE" name="前台鉴权例外" desc="登录后就可访问">
				<address name="首页菜单请求" url="/portal/menu.ajax"/>	
				<address name="首页" url="/index"/>
				<address name="取用户信息" url="/auth/staff/findLoginStaff"/>
				<address name="退出登录" url="/main.html"/>
				<address name="退出登录" url="/logout"/>
				<address name="个人管理页面" url="/auth/individual/modifyInfo"/>
				<address name="查询个人资料" url="/auth/staff/findLoginStaff"/>
				<address name="修改个人资料" url="/auth/staff/updateStaff"/>
				
				<address name="修改个人密码页面" url="/auth/individual/modifyPwd"/>
				<address name="修改个人密码" url="/auth/staff/changePwd"/>
			</operation>
		</resource>	
	</resource-category>
</domain>
